title,description,url,category,full_content,summary
"Pope Francis, still hospitalized, has pneumonia in both lungs - The Washington Post",Vatican officials cleared his schedule through the weekend due a “complex” infection plaguing the 88-year-old pontiff.,https://www.washingtonpost.com/world/2025/02/18/pope-francis-pneumonia-hospitalized/,politics,"ROME — Pope Francis is suffering from pneumonia in both lungs, the Vatican disclosed late Tuesday, as officials cleared his schedule through the weekend because of a “complex” infection plaguing the 88-year-old pontiff. Francis, who had part of one lung removed in his youth, was admitted to Rome’s Agostino Gemelli Polyclinic hospital Friday after developing another in a series of battles with bronchitis. Preliminary tests indicated that Francis had a respiratory tract infection and was running a slight fever as he underwent treatment.

Late Tuesday, however, the Vatican said chest X-rays showed he had developed a polymicrobial infection that arose from asthmatic bronchitis and bronchiectasis, a condition in which the airways widen, leading to a buildup of excess mucus that can make the lungs more vulnerable to infection. He is undergoing a “complex” treatment using antibiotic cortisone therapy, the Vatican said.

Advertisement

The pneumonia was detected during a chest CAT scan Francis underwent Tuesday afternoon, which was prescribed by his Vatican health team and hospital doctors.

“Nevertheless,” the Vatican said, “Pope Francis is in good spirits.”

The Vatican added that the pope ate breakfast Tuesday morning and, during the day, alternated rest with prayer and reading. Francis also received Holy Communion. The pope offered thanks for those who “continue to pray for him.”

Daniel Culver, chairman of pulmonary medicine at the Cleveland Clinic, said an 88-year-old with pneumonia requiring hospitalization, “that’s a serious event.” He added, though, that “the majority of patients would still be expected to recover.”

“It’s very difficult to tell how serious” the pope’s pneumonia is without knowing more, Culver said, such as whether or not Francis is in intensive care, or requiring additional oxygen.

Advertisement

Jesse Goodman, a professor of medicine at Georgetown University Medical Center and former chief scientist at the U.S. Food and Drug Administration, said “there’s no question that it’s serious to have pneumonia and more serious when it affects both lungs.”

Reports that the pope was eating breakfast and reading Tuesday morning “are good things,” he added.

Francis has suffered from declining health and mobility for years, and this hospitalization is his fourth since ascending to the papacy in 2013. In 2021, the pope spent 10 days at Gemelli Polyclinic after having 13 inches of his colon removed. In March 2023, he was hospitalized for three days and treated for acute bronchitis after feeling a sharp pain in his chest and having trouble breathing. Francis later said he had pneumonia. He also had abdominal surgery in June 2023 to remove scar tissue and repair a hernia.

Advertisement

He had appeared bloated and weak in the days before his latest admission, often struggling to speak and passing to others tasks that involved his reading aloud. Italian media has reported that doctors had encouraged Francis to go to the hospital for days before he did so Friday.

Francis has fallen and injured himself twice in recent months: first in December, when he appeared with a bruise on his chin at a ceremony to install 21 new cardinals, and again in January, when he injured his right arm.

The Vatican had said Monday that Francis was suffering from a “polymicrobial infection of the respiratory tract” — indicating that the pope was fighting a multipronged infection that it said required “adequate hospitalization.”

His doctors, the Vatican said, have ordered “absolute rest.”

On Tuesday, the Vatican said Francis would skip a Saturday audience related to the church’s jubilee, which is bringing millions of Catholics to Rome this year. He was also scheduled to say a Sunday Mass but has delegated that duty to a senior Vatican official.","Pope Francis is suffering from pneumonia in both lungs, the Vatican disclosed late Tuesday. Officials cleared his schedule through the weekend because of a “complex’ infection. Francis, who had part of one lung removed in his youth, was admitted to Rome’s Agostino Gemelli Polyclinic hospital."
Dominican officials cram thousands of inmates facing no charges into overcrowded prisons - NPR,"Despite promises to improve the system, problems within prisons keep mounting. Critics say the Dominican Republic continues to push for pretrial detentions in cases where no charges have been filed.",https://www.npr.org/2025/02/19/nx-s1-5301669/dominican-republic-prisons-overcrowding,politics,"Dominican officials cram thousands of inmates facing no charges into overcrowded prisons

toggle caption Ramon Espinosa/AP

SANTO DOMINGO, Dominican Republic — They're known as ""frog men,"" inmates who are forced to sleep on prison floors across the Dominican Republic, often next to overflowing toilets or holes in the ground that serve as one.

Thousands of them are crammed into the country's severely overcrowded prisons, some operating at seven times their capacity. A majority languish there without ever having been charged with a crime, and activists warn they face inhuman conditions and a lack of medical care.

Despite promises to improve the system, critics say the Dominican Republic continues to push for and allow pretrial detentions in nearly all criminal cases where no charges have been filed and has made few changes as problems within prisons keep mounting.

Sponsor Message

""Prisons have become no man's land,"" said Rodolfo Valentín Santos, director of the Dominican Republic's National Public Defense Office.

Over 60% of the country's roughly 26,000 inmates are being held under preventive detention, without any charges, according to the National Public Defense Office. Proponents argue the measure aims to protect society and allows authorities time to collect evidence in a case.

But some detainees have spent up to 20 years in prison without ever being found guilty of a crime, Valentín said.

He noted that the country's Constitution and penal code dictate that preventive detention is an ""exceptional"" measure. There are six other measures that don't involve prison time, including bail, but Valentín said they are rarely used.

'We have a situation'

On a recent afternoon, Darwin Lugo and Yason Guzmán walked out of La Victoria National Penitentiary, in the northeast corner of the sprawling capital, Santo Domingo.

The prison was built for a maximum of 2,100 inmates but holds more than 7,000 of them, with more than 3,300 under pretrial detention, according to the National Public Defense Office.

It is the country's oldest and most populated prison.

""You have to watch out for your life,"" said Lugo, who with Guzmán visited several friends held there, some under pretrial detention.

""There are a lot of them who are not doing well,"" Guzmán said of inmates there. ""There's extreme poverty.""

Sponsor Message

They said their friends, who have spent more than five years incarcerated there, are well-connected and only occasionally request money or ask that their cell phone's SIM card be recharged.

Last year, at least 11 inmates died at La Victoria following a short circuit in a cell that sparked a fire and an explosion. It was one of the country's deadliest prison fires since 2005, when at least 134 inmates were killed in the eastern town of Higüey after rival gangs set their bedding ablaze.

After last year's fire at La Victoria, Dominican President Luis Abinader appointed former prisons director Roberto Santana as head of a commission tasked with overhauling and improving the country's more than 40 prisons.

""We must admit, gentlemen, that we have a situation in all of the country's prisons,"" Abinader said when he announced the appointment last March. He also announced that money recovered from corruption cases would help fund construction of new prisons.

Santana has long called for the closure of La Victoria and the 15 de Azua prison, located in the country's western region. The commission he leads is working on those and other monumental tasks, free from outside interference, he said.

""We don't take orders from politicians or anyone else,"" said Santana, who previously trained staff for the new prisons built in the early 2000s.

Santana, who once served as president of the Federation of Dominican Students in the 1970s, was arrested multiple times under President Joaquín Balaguer, known for having political opponents and dissidents jailed and sometimes killed.

Santana knows first-hand the conditions of La Victoria — he spent two years in solitary confinement there.

'On the brink of collapse'

In the early 2000s, the Dominican Republic began building 21 new prisons to improve conditions. They were staffed by trained personnel, not police and soldiers, which oversee the country's other 19 prisons.

But conditions in the new prisons have deteriorated, according to the Dominican Republic's National Commission of Human Rights.

""The Dominican Republic's prison system is on the brink of collapse,"" the commission said in its 2023 report, the latest one available.

In prisons across the country, overcrowding is rampant. Cells lack bathrooms, natural light and ventilation, leading to worsening health conditions. Some 5,000 inmates are ill with conditions ranging from heart problems to cancer to HIV, but they receive only the most basic medication, if that, and some prisons have no medical staff, according to Valentín, whose office issues a yearly in-depth report on the conditions of all prisons.

Sponsor Message

In its 2023 report, the latest year available, his office called for the closure of prisons including one in the north coastal city of Nagua.

""The level of overcrowding…makes it impossible to achieve true rehabilitation for the inmates since they have been forgotten by the state,"" the report read. ""In the conditions they are in, it is obvious that they are treated as objects and not as human beings endowed with rights.""

Another prison was so overcrowded that the government held inmates outdoors in trucks with metal roofs that broiled under the sun, sparking lawsuits, Valentín said.

A spokesperson for Col. Roberto Hernández Basilio, director of prisons, did not respond to requests for an interview. Hernández has previously said his office is taking measures to improve conditions.

Meanwhile, Dominican Attorney General Miriam Germán Brito has repeatedly spoken out against pretrial detention but noted that the decision lies in the hands of judges. A spokesperson for Germán said she is not granting media interviews.

Both Santana and Valentín said they believe government corruption is one reason the country has dragged its feet in overhauling the system, accusing soldiers and police who run prisons of benefiting from illegal activities.

Public corruption also prompted authorities to halt construction of a much-touted prison in recent years that was expected to ease overcrowding.

Even as that half-built prison wastes away, Santana said he expects that 25 new prisons capable of holding more than 20,000 inmates will be built by 2028.

While those are expected to help ease overcrowding, concerns remain. Activists note that inmates are not freed even when a judge has legally released them.

The National Commission of Human Rights noted that roughly 2,700 inmates are still in prison because their paperwork is paralyzed in backlogged courts. Meanwhile, hundreds of others remain incarcerated despite being officially freed because they owe the government money and are unable to pay fines ordered by a judge.", Dominican officials cram thousands of inmates facing no charges into overcrowded prisons. A majority languish there without ever having been charged with a crime. Activists warn they face inhuman conditions and a lack of medical care.
"Horoscope for Wednesday, February 19, 2025 - Chicago Sun-Times",,https://chicago.suntimes.com/horoscopes/2025/02/19/horoscopes-today-wednesday-february-19-2025,politics,"Moon alert

There are no restrictions to shopping or important decisions. The moon is in Scorpio.

Aries (March 21-April 19)

A positive day

This is a good day to wrap up details related to mortgages, loans, shared property and inheritances. For four months, issues related to home and family have been muddled, confused and delayed. Fortunately, in the next 10 days, you’ll see a light at the end of the tunnel — and it won’t be a train.

Taurus (April 20-May 20)

An average day

Discussions with spouses, partners, friends and groups will be practical and sensible today. Possibly, someone older or more experienced will have advice for you. If so, listen. (This might be challenging to do because you feel rebellious and restless today.)

Gemini (May 21-June 20)

A positive day

This is a productive day for you! Furthermore, it’s an excellent day to clear away clutter and get a better idea of what it is that you need to do. Think about long-term goals. Someone more experienced than you might have advice. (It never hurts to listen, because you don’t have to reinvent the wheel.)

Cancer (June 21-July 22)

A positive day

Because you’re in a practical frame of mind, you can learn and study. You can also make advances in a serious writing project or a manuscript. Or you can deal with the myriad details involved in planning a vacation. However, parents should be vigilant about their kids to avoid accidents.

Leo (July 23-Aug. 22)

An average day

Tread carefully when dealing with authority figures today because something unexpected might happen. They might refuse a request or make an unusual demand or do something that you least expect. Therefore, play your cards close to your chest. Be sensible about financial matters.

Virgo (Aug. 23-Sept. 22)

An average day

Pay attention to everything you say and do because this is an accident-prone day for you. On the upside, you might have some brilliant, genius-like ideas. Meanwhile, discussions with partners and spouses will be practical and sensible. Good time to wrap things up.

Libra (Sept. 23-Oct. 22)

An average day

Keep an eye on your money and your possessions because this is an unpredictable day for your assets. You might find money; you might lose money. Be smart and protect what you own against loss, theft or damage. Meanwhile, this is a productive day at work. Expect results.

Scorpio (Oct. 23-Nov. 21)

A positive day

Results will come to you today through willing acceptance of duty and obligation to others, especially children or partners in creative ventures. Do what you can to keep things practical and orderly. (Expect a few surprises from someone close to you.)

Sagittarius (Nov. 22-Dec. 21)

An average day

Today you might be dealing with hidden, private issues. (Or perhaps, you yourself might want to be hidden from others?) Practical discussions about home and family issues will take place. Meanwhile, something related to your job, your pet or your health might surprise you.

Capricorn (Dec. 22-Jan. 19)

An average day

You might meet a character today or someone you know (perhaps a friend or a member of a group) will do something that surprises you. Or perhaps the mandate of a group has changed in a way that surprises you? Meanwhile, this is a good day to tidy up the details of your everyday world.

Aquarius (Jan. 20-Feb. 18)

An average day

Be respectful when dealing with parents, bosses, teachers and the police today because their response to you might catch you off guard. (Never underestimate the power of courtesy.) Meanwhile, serious discussions about your assets and earnings might take place. Do your homework.

Pisces (Feb. 19-March 20)

A positive day

Be mindful of everything you say and do because this is an accident-prone day for your sign. Meanwhile, this is an excellent day to study and learn new things because you have perseverance and focus. You won’t overlook details. Some will focus on travel.

If your birthday is today

Actress Millie Bobby Brown (2004) shares your birthday. You are an independent problem solver who is sensitive to the needs of others. You are also mystical and artistic. This year, it’s your turn to socialize and have fun! Let your guard down and loosen up a bit. Old friends may reappear to rekindle relationships.

","Aries (March 21-April 19) is a good day to wrap up details related to mortgages, loans, shared property and inheritances. It’s an excellent day to clear away clutter and get a better idea of what it is that you need to do."
"Asian Stock Rally Pauses, China Tech Shares Gain: Markets Wrap - Yahoo Finance","(Bloomberg) -- Asian stocks pulled back after a five-day rally that pushed a regional gauge into overbought territory, as investors turned cautious amid...",https://finance.yahoo.com/news/asia-traders-cautious-trump-floats-225452223.html,politics,"(Bloomberg) -- Stocks closed at all-time highs as traders looked past signals the Federal Reserve is in no rush to cut interest rates.

Most Read from Bloomberg

Just as in the previous session, equities gained traction in the final stretch of trading. That was after the Fed minutes only reiterated the cautious stance by US policymakers amid economic strength and stubborn inflation. Treasuries advanced as officials also discussed pausing or slowing the balance-sheet runoff until the debt-ceiling drama is resolved.

Subscribe to the Bloomberg Daybreak podcast on Apple, Spotify or anywhere you listen.​​​​​​

“They will sit and wait before cutting again,” said Peter Boockvar, author of The Boock Report. “I say ‘cut’ because it still seems like they have an easing bias. The Fed also commented on the balance sheet. This could also be a reason why yields dipped a bit.”

The S&P 500 rose 0.2%. The Nasdaq 100 wavered. The Dow Jones Industrial Average added 0.2%

In a sign of caution, defensive industries outperformed. Quantum-computing shares jumped on Microsoft Corp.’s new chip. Homebuilders sank after results from Toll Brothers Inc. and key construction data indicated the residential real estate market may be in store for more turbulence.

The yield on 10-year Treasuries declined two basis points to 4.53%. The Bloomberg Dollar Spot Index rose 0.2%.

Corporate Highlights:

Apple Inc. introduced a new low-end smartphone called the iPhone 16e priced at $599, aiming to revive growth after a sluggish holiday season.

Nikola Corp. filed for bankruptcy, culminating a long decline for the onetime darling of the electric-vehicle industry, which grappled with weak sales and cycled through CEOs in the wake of a fraud scandal.

Carvana Co. expects retail vehicle sales and earnings to continue growing this year after reporting a record fourth quarter that easily beat Wall Street forecasts.

SolarEdge Technologies Inc. surpassed sales forecasts, triggering an apparent short-covering rally.

Elliott Investment Management is seeking seats on the board of oil refiner Phillips 66, the latest effort in a multi-year campaign pushing the company to sell assets, improve operational performance and bolster board oversight.

Hims & Hers Health Inc. is expanding beyond its successful foray into providing copycat weight-loss drugs with the acquisition of a home blood-testing company.

Roper Technologies Inc. is exploring a sale of its Neptune Technology Group division, according to people with knowledge of the matter.

Story Continues",Stocks closed at all-time highs as traders looked past signals the Federal Reserve is in no rush to cut interest rates. Treasuries advanced as officials discussed pausing or slowing the balance-sheet runoff until the debt-ceiling drama is resolved.
"Key takeaways from ""brothers"" Trump and Musk's ""Hannity"" interview - Axios",Trump revealed how much X paid him to settle his lawsuit over Twitter's ban following the Jan. 6 Capitol riot.,https://www.axios.com/2025/02/19/trump-musk-hannity-takeaways,politics,Full article unavailable. Click the source link for details.,CNN.com will feature iReporter photos in a weekly Travel Snapshots gallery. Visit CNN.com/Travel each week for a new gallery of snapshots from around the world.
iPhone 16E Name is Increasingly Likely Instead of iPhone SE 4 - MacRumors,"Apple is expected to announce a new entry-level iPhone model tomorrow, and it is increasingly likely that the device will be named iPhone 16E.   Most...",https://www.macrumors.com/2025/02/18/iphone-16e-name-is-likely/,politics,"Apple is expected to announce a new entry-level iPhone model tomorrow, and it is increasingly likely that the device will be named iPhone 16E.



Most rumors have referred to the device as a new iPhone SE, since it will succeed the iPhone SE (3rd generation), but there is mounting evidence that the device will be named iPhone 16E instead of iPhone SE (4th generation).

As a refresher, the iPhone 16E name was first mentioned in December by Fixed Focus Digital, an account with more than two million followers on Chinese social media platform Weibo. Later that month, a leaker known as Majin Bu on X also cited a source who claimed that the next iPhone SE will actually be named iPhone 16E.

In a follow-up post today, Majin Bu cited a source who has apparently seen an iPhone box with the name iPhone 16E on it. In addition, Bloomberg's Mark Gurman believes that Apple CEO Tim Cook's teaser post about a ""new member of the family"" being announced this Wednesday suggests that the device will indeed have a new name. And last, there are several Amazon listings for so-called iPhone 16E cases, although that could be guesswork.



The device is rumored to feature a larger 6.1-inch OLED display, Face ID, an A18 chip, a USB-C port, Apple Intelligence support, an Apple-designed 5G modem, and more. Apple should reveal pricing and a release date tomorrow.",Apple is expected to announce a new entry-level iPhone model tomorrow. There is mounting evidence that the device will be named iPhone 16E instead of iPhone SE.
From Metal Rain to Roaring Jet Streams: The First 3D Look at an Alien Atmosphere - SciTechDaily,"Astronomers have unlocked a new way to explore alien worlds by mapping the 3D structure of an exoplanet’s atmosphere for the first time. Using ESO’s Very Large Telescope, they discovered extreme winds carrying iron and titanium across the skies of WASP-121b, …",https://scitechdaily.com/?p=456033,politics,Full article unavailable. Click the source link for details.,CNN.com will feature iReporter photos in a weekly Travel Snapshots gallery. Visit CNN.com/Travel each week for a new gallery of snapshots from around the world.
Google app on iOS removing Gemini as it pushes users to full app - 9to5Google,The Google app for iOS is removing Gemini support as the company pushes iPhone users to the full Gemini app.,http://9to5google.com/2025/02/18/google-app-removes-gemini/,politics,"Google is informing iOS users that it will be removing Gemini support from the main Google app as it pushes users over to the full Gemini app.

One of the first ways to access Gemini on iOS was through the main Google app, which offered a switcher between Google Search and Gemini for several months. However, as Google has built out the Gemini experience, new features have been missing from the Google app – a key example being Gemini Live. That’s because Google has been focused on the full Gemini app for iOS, which launched in November.

Now, Google is letting iPhone and iPad users know that Gemini is “no longer available” in the Google app.

In an email sent to users, Google says that “Gemini is no longer available in the Google app,” emphasizing that “Gemini is now available as its own app, and that’s now the best place to use Gemini.” The email reads in part:

We’re making some changes to create an even better Gemini experience on iOS. Gemini is now available as its own app, and that’s now the best place to use Gemini. To continue using Gemini, download the new Gemini app from the App Store. With the Gemini app, you’ll have access to all of the same features and more.

Google removed the switcher interface earlier this month, as we previously reported, but the experience is currently still live in the app via the “More” tab with Google app v356.0 on iOS. However, we previously noticed that a pop-up that directs users to instead download the full Gemini app for iOS via the App Store.

Some users may no longer be able to use Gemini in the Google app for iOS

More on Gemini:

Follow Ben: Twitter/X, Threads, Bluesky, and Instagram",Google is removing Gemini support from the main Google app for iOS. The move will push users over to the full Gemini app. Google says Gemini is now available as its own app and that’s now the best place.
