title,description,url,category,full_content,summary
Motorsport.com ranks every 2025 F1 livery - Motorsport.com,"The 2025 F1 season has arrived, beginning with a history-making reveal of all 10 team's liveries for the year. What's the best-looking one to grace the stage? You'll have to see them all to find out.",https://www.motorsport.com/f1/news/motorsportcom-ranks-every-2025-f1-livery-/10696926/,sports,"As the curtain fell on the bombastic F1 75 event at the O2 Arena in London, all 10 liveries that Formula 1’s teams will use in 2025 were revealed over the course of the night – between various musical performances and distinctly varied presentations from each team.

Everyone will have their own opinion on which (old spec) car was best dressed on the night, and the beauty of livery design is that it’s a purely subjective art. Even last year’s Alpine ‘livery’ had fans...somewhere, presumably.

Throughout the 2025 season, we’ll be continuing with our ratings for each driver after every race but, on this occasion, we’ll instead be giving our marks out of 10 for the presentations of the liveries this season.

They’ll be marked on originality, whether it’s an upgrade on last season’s paint scheme, and quite simply due to the author’s own tastes. One’s fellow writers won’t agree, and we’d be surprised if you did too – you have the opportunity to offer your own points of view in the comments.

Without further ado...

10 - Aston Martin Racing

Aston Martin Racing AMR25 Photo by: Aston Martin

This livery is a considerable downgrade. It’s hard to go wrong with British Racing Green, especially with Aston Martin’s modern-day icon of fluorescent yellow trim, but the black sidepods appear completely incongruous with the rest of the livery.

Is that a hint that the AMR25 will roll out in Bahrain with a little bit of a weight problem, and that the revised sidepods are going to be in naked carbon in Bahrain testing? We wait, indeed, with bated breath...

It’s hard to love the new direction for the livery, especially as Aston Martin could have played this very safe and turned up with something that still looked stellar.

9 - Red Bull Racing

Red Bull Racing RB21 Photo by: Red Bull Content Pool

The same. As usual. It's become a bit tired (and the cringe factor of the presentation) brings it down a couple of points.

Is there anything more to add? Oh, the sponsor on the rear wing is different. That’s...something.

8 - Williams

Williams FW47 Photo by: Williams

It’s blue. Very blue. I mean, it’s fine if you like blue, with a dark blue to medium blue gradient through the car. But it just feels a little bit...low effort, perhaps? The tesselating blue pattern from the previous couple of cars is gone, and the yellow engine cover tease used at the end of last season is nothing but a distant memory.

It appears the overall livery has been simplified to accentuate the rather conspicuous Atlassian logos now added to the engine cover as Williams has signed what has been touted as its biggest title partnership ever.

The Duracell battery engine cover remains, but the novelty has probably worn off.

7 - Sauber

Kick Sauber C45 Photo by: Liberty Media

The key issue with 2024’s livery was that it looked somewhat pedestrian; the weight-saving efforts with the nude carbon fully dampened the potential of leading with a neon green scheme.

Thankfully, this year’s effort is much more cohesive. Clearly influenced by the better reception its Las Vegas rendition got, the use of green is more liberal in the first two-thirds of the car. Then there’s a fade gradient that transitions into what appears to be naked carbon at the rear.

The car shown at the event seemed to be in a much less ennobling livery than the launch images revealed by the team in its press materials. If the actual car looks like the render images, and if that gradient actually blends well into the carbon, then it could be a hit.

6 - McLaren

McLaren MCL39 Photo by: McLaren

Team principal Andrea Stella stated that McLaren wanted continuity with its constructors’ championship winner from 2024, and it’s done that; it keeps the papaya flashes draped on top of black carbon in pretty much exactly the same arrangement as before.

For those hoping for something a little bit more from the team, then you’ll be disappointed. Ultimately isn’t a bad livery by any stretch, but it’s not a great one either; it just merely exists to maintain its post-Ron Dennis-era identity and act as a platform for its plentiful commercial partners. Could there be more orange? Yes. Could the team have played about with the form factor a little more? Yes. But hey, they like what they had – and that’s okay.

5 - Haas F1 Team

Haas VF-25 Photo by: Haas F1 Team

Less naked carbon, more chance for the designers to flex their creative chops — and Haas has delivered something that should stand out more than its usually conservative efforts.

A fresh spin on the white, black, and red tones that it has stuck to in the past few seasons looks good, and it’s refreshing to see the sidepods get a bit more of a brighter treatment than just a giant Haas logo splodged on the face.

Is it the standout from the batch? No, but it’s unmistakably brand loyal and represents one of the more imaginative efforts from the American squad.

4 - Ferrari

Ferrari SF-25 Photo by: Ferrari

It's red, but it appears to be a much bloodier hue – much like in 2022 - versus the shades of red used over the past couple of years. The added white on the engine cover, naturally to accentuate the HP title sponsorship, rather harks back to the Michael Schumacher days — particularly at the races when its Marlboro sponsorship was covered up by a white square.

The yellow notes are gone, which is a little bit sad. And if we’re being really picky, the UniCredit sponsorship doesn’t entirely sit well with the rest of the car; the white outlines look a little clumsy. At least the accent stripe relates to its similar World Endurance Championship livery.

I don’t hate this – actually, it’s a decent effort to wrap in HP’s corporate desires into Ferrari’s historic back catalogue of red and white efforts. But I suspect I might be in the minority.

3 - Mercedes

Mercedes F1 W16 Photo by: Getty Images

Same, but different. The extra silver on the engine cover and flanks is a nice touch, which upgrades the already-pretty 2024 livery. That begs the question over the scope of INEOS’ involvement with the team, as the red flash that usually surrounded its rollhoop branding is gone – as is said branding, much reduced over the revised livery that will adorn the W16.

The use of Petronas teal remains tasteful, separated from the silver by the use of black around the car, as suitable Mercedes branding continues to pepper the livery’s blanker spots.

As we said, it’s an upgrade and I’m quite fond of it. Perhaps there was more scope to be imaginative around the sidepods, which remain black with a teal flash. Otherwise, it’s a lovely livery.

2 - Alpine

Alpine A525 Photo by: Alpine

That’s more like it! After last year’s woeful effort as it eschewed paintwork in line with its overweight chassis, Alpine at least started to add a little bit more paint back onto the car towards the end of 2024. This time, it’s back with a bang – and for followers of F1 esoterica, with a paint job similar to Brabham’s 1992 BT60B.

The pink nose wouldn’t flawlessly merge with the metallic blue, so the carbon black has been kept sparingly to create space between the two. To see Alpine’s ‘proper’ brand colours back in F1 is a welcome sight, and the team has been bold with its inventive contrast between colours. In other words, it’s anathema to last year’s carbon-heavy liveries.

Further notes: the team has opened its livery space on the engine cover to new fuel partner Eni, which returns to F1 for the first time (when it was Agip) since 2000. You’ll see the pink and blue machines from a mile away – which is what a distinctive livery is all about. Quite the turnaround – chapeau, Alpine.

1 - Racing Bulls (VCARB)

Racing Bulls VCARB 02 Photo by: Red Bull Content Pool

“White like Turkey teeth,” said comedian Munya Chawawa, who was brought in to present the team’s new identity. And... it’s very white, but with the clearest Red Bull iconography that the team has used since its days as Toro Rosso.

There's the yellow nose cap and roll hoop, flanked by the scarlet hues of the energy drink brand’s bull logo. The white backdrop is likely all the better for the myriad sponsors involved, which no longer have to rely on the clumsy white blocks of colour hurled onto the metallic blue tones that RB used last year.

There’s at least a little bit of blue on the car, albeit at the rear as it progresses into an MC Escher-esque transition from a dark blue to white with the use of further Red Bull logos.

Think Red Bull’s revered 2020 Turkey one-off livery, but perhaps a little more cluttered. It’s still pretty nice, though.

Photos from the F1 75 Live season launch",All 10 liveries that Formula 1's teams will use in 2025 were revealed over the course of the night at the O2 Arena in London. We’ll be giving our marks out of 10 for the presentations of the liveries this season.
Source: Giroud's L.A. home robbed in $500K heist - ESPN,"LAFC striker Olivier Giroud lost approximately $500,000 worth of jewelry when his Los Angeles home was burglarized earlier this month, a source told ESPN.",https://www.espn.com/soccer/story/_/id/43909762/lafc-striker-giroud-home-robbed-500k-heist,sports,"Open Extended Reactions

LAFC striker Olivier Giroud lost approximately $500,000 worth of jewelry when his Los Angeles home was burglarized earlier this month, a source told ESPN.

The Los Angeles Police Department confirmed on Tuesday they had responded Feb. 5 to a report of a window smash at a home in west L.A. The caller, who the source said was Giroud's wife Jennifer, reported an upstairs bedroom window broken and their home burglarized.

The LAFC forward and his family were not at the property when burglars broke in and stole jewelry and other items -- including 10 luxury watches -- belonging to the 2018 World Cup winner.

LAFC spokesperson Seth Burton declined to comment on behalf of Giroud and the organization beyond confirming the burglary report.

The 38-year-old former Chelsea and Arsenal star is in the final stages of preparation with LAFC for the upcoming MLS season, with his team kicking off against Minnesota United at home Saturday.

On Tuesday night, Giroud started for LAFC in their 2-1 loss against the Colorado Rapids in the first leg of Round 1 of the Concacaf Champions Cup.

Giroud has not scored in 14 games for LAFC since his move from AC Milan to MLS last summer.

He is the latest high-profile athlete to be the victim of such an incident after the likes of NFL stars Patrick Mahomes, Travis Kelce and Joe Burrow had their homes burglarized in recent months.

The L.A. police have not made any arrests associated with the burglary and are continuing to investigate the matter.

Giroud is best known for his six prolific seasons at Arsenal from 2012-18, followed by three years apiece at Chelsea and Milan. He has scored 285 goals in 716 matches during his club career while winning a wealth of trophies, including a Champions League triumph with Chelsea three years ago.

He was also a star for the France national team, scoring a record 57 goals and playing for Les Bleus' World Cup winners in 2018.

Information from The Associated Press was used in this story.","LAFC striker Olivier Giroud's home was burglarized earlier this month, a source says. Giroud and his family were not at the property when burglars broke in and stole jewelry. The 38-year-old former Chelsea and Arsenal star is in the final stages of preparation with LAFC."
Cubs To Sign Justin Turner - MLB Trade Rumors,The Chicago Cubs have reached an agreement with free agent Justin Turner.,https://www.mlbtraderumors.com/2025/02/cubs-close-to-signing-justin-turner.html,sports,"Feb. 19: Turner has reported to camp and is prepping for his first workout with the team, per Bruce Levine of 670 The Score. The Cubs still haven’t formally announced the signing, but his presence in camp surely means an announcement and corresponding 40-man move are imminent.

Unsurprisingly, he’ll work primarily as a first baseman and as a designated hitter, per Patrick Mooney of The Athletic. Turner only has 90 innings at third base over the past two seasons, so logging any kind of regular action there was never likely. He could get an occasional spot start, but the likelier role will be to spell Busch once or twice per week, spell Suzuki on occasion, and step in as DH when Suzuki is filling in at the outfield corners.

Feb. 18: The Cubs are reportedly in agreement with 40-year-old free agent Justin Turner on a one-year, $6MM deal. The signing, which is still pending a physical, includes another $2.5MM in performance bonuses for the Vayner Sports client. Chicago will need to make a 40-man roster move once the deal is finalized.

Despite his age, Turner remained a productive bat for the Blue Jays and Mariners in 2024. He hit 24 doubles and 11 home runs while continuing to make the most of his plate discipline and contact skills en route to a .737 OPS and 117 wRC+. The righty batter was particularly productive for Seattle in September, slashing .295/.396/.449 with a 143 wRC+. In other words, there is little reason to doubt that he can still be a valuable contributor to a team with postseason aspirations.

Turner has qualified for the batting title in each of the past four seasons, but he will take on more of a part-time role with the Cubs. ESPN’s Jesse Rogers notes that Turner is expected to fill a backup role at first and third base. Chicago reportedly considered many options for such a job but ultimately settled on Turner after missing out on star third baseman Alex Bregman (per Rogers). The Cubs were a finalist to sign Bregman before he joined the Red Sox instead. The team also reportedly considered trading for Nolan Arenado, although it comes as no surprise that the Cardinals weren’t interested in trading Arenado to a division rival (per Mooney).

Primarily a third baseman in his younger days, Turner has only played a handful of games at the hot corner in each of the past two seasons. Instead, he has transitioned to a first base/DH role. However, both of those jobs are already spoken for in Chicago, with the promising sophomore Michael Busch at first base and Seiya Suzuki, arguably the team’s second-best hitter after Kyle Tucker, penciled in at DH.

So, Turner is likely to get his playing time as a backup option at multiple positions and a bat off the bench. He could also platoon with Busch at first if the lefty batter continues to struggle against same-handed pitching. On top of that, Turner will offer the club insurance in the case of an injury to Busch, Suzuki, or a corner outfielder; if Tucker or Ian Happ gets hurt, Suzuki could play the outfield with Turner taking over as the primary DH.

In addition, Turner will provide a bit more stability at third base, which is currently something of a question mark for the Cubs. Top prospect Matt Shaw seems to be the most likely choice to win the third base gig out of camp, but the 23-year-old has yet to play a game at the big league level. Thus, president of baseball operations Jed Hoyer made it clear that Shaw is not yet guaranteed the starting job. However, the Cubs don’t exactly have a ton of other options. Jon Berti and Vidal Brujan both have MLB experience at third, but neither is a starting-caliber player at the position. Meanwhile, Rule 5 pick Gage Workman is himself an unknown quantity; he has not played a game above Double-A. The 40-year-old Turner isn’t necessarily a solution, but he will, at least, improve the team’s depth at third. His glove might be a liability, but if nothing else, he’s a talented hitter who knows how to play the position.

Patrick Mooney of The Athletic was first to report that the Cubs and Turner were finalizing a one-year, $6MM deal. Jon Heyman of The New York Post confirmed there was an agreement in place and reported the $2.5MM in performance bonuses.",Justin Turner has reported to camp with the Cubs. He'll work primarily as a first baseman and as a designated hitter. Chicago will need to make a 40-man roster move once he's signed.
The Real Madrid starting lineup that has a 99% chance of beating Manchester City - AS USA,Antonio Rüdiger is fit to return for the Champions League knockout phase playoff game and will renew his titanic battle with Erling Haaland.,https://en.as.com/soccer/the-real-madrid-starting-lineup-that-has-a-99-chance-of-beating-manchester-city-n/,sports,"Real Madrid have been handed a huge boost ahead of the Champions League knockout phase playoff second leg against Manchester City by the return to action of Antonio Rüdiger, who will renew his battle with Erling Haaland.

Madrid will, of course, line up with their “Fantastic Four” (Bellingham, Rodrygo, Mbappé, Vinicius) in attack. The only likely “surprise” in Carlo Ancelotti’s team is Fede Valverde at right-back, although that hardly comes out of the blue.

Even the Uruguayan himself is getting more comfortable in the role: “I think I’ve done pretty well when I’ve had to play there. I try to contribute, give my all, get forward, defend… If I don’t get many chances in midfield in the future, I’m sure I’ll be a right-back.”

Guardiola: “City have a 1% chance of beating Real Madrid”

City coach Pep Guardiola made headlines before the game by claiming his team only has a 1% chance of progressing to the round of 16. Ancelotti, though, isn’t falling into his counterpart’s trap. “He doesn’t really think that, I’ll ask him before the game.”

Against City, the Italian will use the strongest possible weapons he has at his disposal.

Real Madrid attack guarantees goals

Starting in attack, with Bellingham, Rodrygo, Mbappé and Vinicius ready to fire Madrid into the next round. Between them, the quartet has scored 66 of Los Blancos' 98 goals this season and the Spaniards will almost certainly progress to the next round if they are anywhere near top form.

With Valverde needed at right-back and Rüdiger returning in central defence, a space has opened up again in midfield for Aurélien Tchouaméni.

The Frenchman has been criticized by many, but is indispensable for Ancelotti. Although Camavinga is also in with a chance of starting, Tchouaméni’s defensive instincts and positional sense put him in pole position.

His partner, no matter how well Luka Modric might be playing, will be Dani Ceballos. The former Betis star has earned his place in the big games with recent performances. His passing accuracy has resembled that of Toni Kroos, exceeding 95% from over 100 passes per game. The 28-year-old has gained Ancelotti’s trust.

Possible Real Madrid XI to play Manchester City

Of those not already mentioned, Thibaut Courtois will take up his usual spot in goal. Rüdiger is expected to be joined in central defence by Raúl Asencio, with Ferland Mendy and Fran García continuing their ongoing battle to be named at left-back. The Frenchman may get the nod for his experience.

The lineup Ancelotti has in mind to face City is: Courtois; Valverde, Asencio, Rüdiger, Mendy; Tchouameni, Ceballos; Rodrygo, Bellingham, Vinicius; Mbappé.

Related stories

Article originally written in Spanish, translated with the assistance of AI and edited by Roddy Cons.

Get your game on! Whether you’re into NFL touchdowns, NBA buzzer-beaters, world-class soccer goals, or MLB home runs, our app has it all. Dive into live coverage, expert insights, breaking news, exclusive videos, and more – plus, stay updated on the latest in current affairs and entertainment. Download now for all-access coverage, right at your fingertips – anytime, anywhere.",Real Madrid face Manchester City in Champions League playoff second leg. Antonio Rüdiger set to return for Carlo Ancelotti's side. Manchester City coach Pep Guardiola claims Real have a 1% chance of winning.
Rob Manfred Defends Dodgers Amid MLB Fan Criticism Over Spending Spree - Sports Illustrated,MLB commissioner Rob Manfred defended the Dodgers from fan criticism over the club's spending in free agency.,https://www.si.com/mlb/rob-manfred-defends-dodgers-amid-mlb-fan-criticism-over-spending-spree,sports,Rob Manfred again defended the Dodgers but also said he’s understanding of fans who are concerned. pic.twitter.com/GKoHIiHbGC,Rob Manfred again defended the Dodgers but also said he’s understanding of fans who are concerned. pic.twitter.com/GKoHIiHbGC
"Saints Hire Scott Tolzien, T.J. Paganetti; ‘Zeroing In’ On Doug Nussmeier As OC - profootballrumors.com",The Eagles are continuing to fill out the staff of new head coach Kellen Moore.,https://www.profootballrumors.com/2025/02/saints-hire-scott-tolzien-t-j-paganetti-zeroing-in-on-doug-nussmeier-as-oc,sports,"Like many coordinators who get head coaching opportunities, Kellen Moore is bringing multiple members of his staff in Philadelphia to his new job in New Orleans.

The Saints “are currently working to finalize a deal” to make Doug Nussmeier their next offensive coordinator, per veteran NFL insider Josina Anderson. Nussmeier spent 2024 as the Eagles’ quarterbacks coach and is considered the frontrunner for the job position in New Orleans. He previously coached quarterbacks for the Chargers and the Cowboys. Nussmeier also served as offensive coordinator for several major college programs from 2008 to 2017, including Alabama, Florida, and Michigan.

Nussmeier isn’t the only top Eagles assistant following Moore to New Orleans. The Saints are also hiring Eagles run game specialist and assistant offensive line coach T.J. Paganetti, per Nick Underhill of NewOrleans.Football. He has spent the last eight seasons in Philadelphia, working closely with legendary Eagles offensive line coach Jeff Stoutland. Paganetti will likely take over as the Saints’ offensive line coach after John Benton followed Klint Kubiak to Seattle.

Moore is hiring another familiar face to serve as quarterbacks coach in Scott Tolzien, per NFL Network’s Ian Rapoport. Tolzien was an assistant in Dallas when Moore was the Cowboys’ offensive coordinator from 2020 to 2022. Tolzien was promoted to quarterbacks coach after Moore moved on in 2023, but was not expected to be retained on Brian Schottenheimer‘s new staff.

Tolzien, a former NFL quarterback himself, will help the Saints navigate an uncertain quarterback situation this year. Derek Carr performed well in 2024, but struggled to stay healthy. His durability will remain a concern entering his age-34 season – if he even stays on the roster – but neither Spencer Rattler nor Jake Haener inspired much confidence in 2024. The Saints’ cap situation will hinder them in the free agent quarterback market, and the draft’s top quarterbacks will likely go before their first round pick (No. 9 overall).",Doug Nussmeier and T.J. Paganetti will join Kellen Moore's new staff in New Orleans. The Saints are working to finalize a deal to hire the Eagles' quarterbacks coach. Nussmeyer has previously coached quarterbacks for the Chargers and the Cowboys. He also served as offensive coordinator for several major college programs.
