title,description,url,category,full_content,summary
Why ‘city-killer’ asteroid YR4’s impact probability keeps increasing - Big Think,"Asteroid 2024 YR4, which could devastate a city's worth of humans, has gone from 1.2% to 2.3% to 2.6% to 3.1% chances of impact. Here's why.",https://bigthink.com/starts-with-a-bang/city-killer-asteroid-yr4-impact-probability/,science,"Sign up for the Starts With a Bang newsletter Travel the universe with Dr. Ethan Siegel as he answers the biggest questions of all Notice: JavaScript is required for this content.

On December 27, 2024, a very small, fast-moving asteroid was found in the vicinity of Earth. Dubbed 2024 YR4, or YR4 for short, it’s approximately 50 meters in diameter, weighs somewhere around 200,000 tons, and made its most recent, closest approach to Earth just two days prior: on December 25, 2024. In the time since its discovery, many observatories have monitored its motion, enabling us to reconstruct its orbit to a fairly good level of precision. We know it orbits the Sun with a period of around 4 years, achieving a maximum distance from the Sun of around 4.18 astronomical units, or right at the outer edge of the asteroid belt. It will make its next close approach to Earth (but will definitively miss us) on December 17, 2028, and then have a second, potentially hazardous encounter with us four years later: on December 22, 2032.

The best data we have indicates that the asteroid will miss us in 2032 by a slim margin: just 160,000 kilometers, or less than half of the distance from the Earth to the Moon. However, our data is still highly uncertain, with a (99.7% confidence) region that spans 1.28 million kilometers across: a region that still definitively includes planet Earth, itself just ~12,750 km in diameter. Since its discovery, the reported odds of an impact with our planet have continued to increase: from 1.2%, initially, to 2.3%, then to 2.6%, and, as of February 18, now 3.1%.

Does this mean we’re at a severe risk of an impact? Not at all. We can expect the probability to continue to increase for a time, and then, all at once, plummet to zero. Here’s the science of why that’s the most likely outcome, plus what humanity’s recourse should be if we get unlucky enough so that an impact becomes inevitable.

This diagram shows the Torino scale, with numbers 0-10, and the evolution from December 2024 to February 2025 (with black arrow) of potentially hazardous asteroid 2024 YR4. The probability of impact increases as the uncertainty in its trajectory decreases, but will suddenly plummet toward 0 if it is determined that the object will miss the Earth. Credit: NASA

What you see, above, is known as the Torino scale: the scale for measuring the potential hazards of an object in space that might strike the Earth. You’ll notice that the chart is divided up in a way that only some objects have any hazard rating at all. An object that will definitely miss us is Level 0; an object smaller than 20 meters in diameter is also Level 0, as even if it strikes us, the maximum amount of damage it could cause would be comparable to the Chelyabinsk impactor of 2013, which only resulted in minor injuries arising from broken glass that shattered during the asteroid’s impact.

Larger bodies do pose a danger, with objects between 20-100 meters falling into the “city-killer” range, objects between 100 meters and 1 kilometer falling into the “regional devastation” category, and with objects greater than 1 kilometer representing an “extinction-level” threat. The greater the probability of impact, the higher the cause for alarm. However, even with all the recent attention given to asteroid YR4, it only ranks a “3” on this scale at present. According to NASA, an object with a Torino scale rating of 3 should be thought of as follows:

“A close encounter, meriting attention by astronomers. Current calculations give a 1% or greater chance of collision capable of localized destruction. Most likely, new telescopic observations will lead to re-assignment to Level 0. Attention by public and by public officials is merited if the encounter is less than a decade away.”

This animation was made as a composite of a series of observations from the ESO’s Very Large Telescope in January of 2025. Asteroid 2024 YR4 is the most potentially hazardous object ever discovered in the 21st century so far. Credit: ESO/O. Hainaut et al.

It’s no stretch to claim that YR4 is the most hazardous object yet identified since the invention of the Torino scale, and yet, it’s still very unlikely to pose any threat to Earth at all. NASA knows this, as you can see in its assertion that, “Most likely, new telescopic observations will lead to re-assignment to Level 0.” However, this both hasn’t been made clear in news reports and the reasons behind why this is the case are almost never discussed. Let’s fix that right now by going through the science of how we calculate orbital trajectories and, along with those calculations, estimate the uncertainties that come along with them.

When you first identify an object through a telescope, there are a lot of things you can observe about it.

You can determine where it is and when, at least, on a two-dimensional projection of the sky.

You can track its motion over time, giving you a series of points-in-time that allow you to determine its motion.

You can use what’s theoretically known about the law of gravity to infer its past and future trajectory as well.

You can fold in the uncertainties that arise owing to the imperfect nature of your tools and measuring devices, projecting that forward to future uncertainties in its orbital path.

And, presuming you know enough about the positions and motions of other gravitationally important bodies in/near its path, including the Sun and the major planets, you can calculate how those trajectories might deviate from a purely Keplerian one in the future.

This diagram shows the relative sizes of a Boeing 747, the Chelyabinsk impactor, asteroid 2009 Sulawesi, and the estimated sizes (black, minimum; grey, maximum) of the Tunguska impactor and asteroid 2024 YR4. The devastation that would be caused by an impact from 2024 YR4 is presently wildly uncertain. Credit: Sinucep/Wikimedia Commons

The more observations you can take of the object — including with better tools, to greater precisions, and over longer baselines of time — the smaller your uncertainties will get, and the more confident you’ll be in your predictions for the object’s future trajectory. On the other hand, when you have fewer observations, including observations that are only acquired over a short period of time or a small fraction of the object’s orbit, your uncertainties will tend to be large.

In general, the best time to observe an object, at least, if your goal is to fully determine its orbital trajectory, is when it’s moving rapidly across the sky: i.e., when it’s close to perihelion, or its closest approach to the Sun. For an object way out in the Kuiper belt, it might take several years of observations to determine a reliable orbit; for an object that’s much closer to us, such as in the inner Solar System, we can do much better with only a few weeks or a couple of months of observations.

Because we only discovered 2024 YR4 in late December of 2024, well after its (November 22nd) perihelion, we’re only able to project its trajectory to within a specific precision at present. Although the best fit estimate to its trajectory indicates that it will miss Earth by ~160,000 km, there’s an uncertainty in that trajectory, primarily in one specific spatial dimension, of ±213,811 km.

This diagram shows the possible paths (red dots) of asteroid 2024 YR4 relative to Earth and the Moon’s orbit, as illustrated by the density of the dots. The most likely scenario is that the asteroid misses Earth and the Moon, with (at present) a 3.1% chance of it striking the Earth and an 0.3% chance of it striking the Moon. The most likely event is no collision at all. Credit: ESA/Planetary Defence Office

Think about what that means for a moment. It means that, based on what we know about this object, the best reconstructed orbital trajectory that we can infer for it implies that it will miss Earth by ~160,000 kilometers: about 12.5 Earth diameters. If we know this trajectory to a precision of ±10,000 km, then we could be completely certain it would miss us; it would take an outlier event of more than a 15-sigma (15 one-sided standard deviations) to lead to a collision, something with negligible (~0) probability.

However, if we only knew this trajectory to a precision of ±40,000 km, we would think it’s likely that this object would miss us, but we’d want better data so that we could exclude a collision at higher significance. In physics and astronomy, that precision (of about 3.8-sigma) only excludes a collision at about the 99.98% level; we would like to be more precise.

With today’s best data — that is, as of February 18, 2025 — our uncertainty on 2024 YR4 is unacceptably large, as this trajectory is only known to a precision of ±213,811 km. We’ll need, realistically, to determine its orbit to a precision that’s about seven times better in order to safely rule out the possibility of an impact.

This animation shows four years of asteroid 2024 YR4’s orbits with respect to the orbits of the inner four planets: Mercury, Venus, Earth, and Mars. In December of 2028, the asteroid will pass relatively close to Earth, but will miss our planet substantially. Four years later, on December 22, 2032, a potential impact may yet occur. Credit: Phoenix7777/Wikimedia Commons

However, we’re in a lousy predicament right now, at least, in terms of the quality of the data we have. When it comes to statistical significance, anytime you see the “±” symbol, followed by a number, you need to ask yourself, “What type of uncertainty is this?” The uncertainty in the trajectory of 2024 YR4, as it’s being widely reported, is ±641,435 km, but that’s a 3-sigma uncertainty, not the standard 1-sigma that corresponds to ±213,811 km. The way statistics works, assuming your only measurement uncertainties are statistical in nature, tells us that:

there’s a ~68% chance that the “true value” lies within 1-sigma of the most likely value,

a ~95% chance that the “true value” lies within 2-sigma of the most likely value,

a ~99.7% chance that the “true value” lies within 3-sigma of the most likely value,

a ~99.99% chance that the “true value” lies within 4-sigma of the most likely value,

and so on.

Because the most likely value is “only” 160,000 km away from Earth, that means that lowering the uncertainty to below its current value of ±213,811 km is going to:

increase the probability of impact as the uncertainty is lowered, ruling out the “misses Earth by a lot” scenarios,

until the uncertainty gets significantly smaller than the “most likely value,”

and then the probability of impact will drop exponentially,

as we will then be able to predict its trajectory more robustly and with smaller errors.

Barringer Crater, also known as Meteor Crater, is an impressive crater located in the Arizona desert, more than a mile in diameter. Although this crater was made tens of thousands of years ago, it was caused by a relatively small impactor estimated at a mere 50-100 meters across: less than a third the size of asteroid Dimorphos, the asteroid that NASA’s DART mission collided with. Although these “city-killer” sized objects are dangerous, the damage they cause remains localized, unlike for larger impact events. Credit: Grahampurse/Wikimedia Commons

This has been precisely the scenario that’s arisen for practically every asteroid ever discovered and tracked, and is very, very likely (with still 96%+ probability) going to apply to 2024 YR4. The prior “record” for most likely terrestrial impact by an identified body went to asteroid Apophis, which was deemed to have a 2.7% chance of striking Earth back in 2004, when it was first discovered. Subsequent measurements better determined its trajectory, and its current risk of impact is deemed at odds much lower than 1-in-a-million. However, until we can reach that level of precision in our measurements for 2024 YR4 — which will likely require observations from the world’s most powerful telescopes, potentially including even JWST — we have to keep ourselves open to the possibility that it may yet strike us.

That possibility makes measuring its trajectory (as well as its other properties) to an incredibly high precision all the more important. 2024 YR4, for example:

could still strike Earth, or it could miss us by hundreds of thousands of kilometers,

could be as small as just 40 meters across, or as large as ~90 meters across,

could have as little kinetic energy as a few hundred kilotons of TNT, or as much as 15 megatons of TNT.

That last uncertainty, arising largely from its uncertainty in overall mass (as we know it will move at around 17 km/s if it strikes Earth in 2032) is the difference between a Chelyabinsk-scale impact, which killed no one, and the type of impact that created Barringer Crater (also known as Meteor Crater) in Arizona, which could kill hundreds of thousands or more if it struck a large city.

This map of Earth is overlaid with the risk corridor of impact of asteroid 2024 YR4. Several major cities lie along this risk corridor, and include South American cities like Bogota, African cities like Lagos, and Asian cities like Mumbai. Credit: Daniel Bamberger (Renerpho)/Wikimedia Commons

And there are, indeed, plenty of large cities in the potential path of 2024 YR4 that could experience dire consequences, including Bogotá, Columbia, Lagos, Nigeria, Sana’a, Yemen, Mumbai, India, and Dhaka, Bangladesh. Even in the event of an oceanic strike, the potential for coastal flooding and tsunami events means there are potentially billions or even trillions of dollars worth of property damage that could occur. If it were determined that 2024 YR4 was indeed at risk of striking Earth — something that should be easy to determine with high-quality data that ought to be acquired over the next few weeks and months — then our best recourse would be to leverage what we learned from the DART mission to redirect an asteroid, and get to work on planning for asteroid deflection of 2024 YR4.

What would that look like?

If you want to redirect a large, massive body in space, you need to course-correct as early as possible. When you’re on the highway and notice your vehicle slightly drifting toward one edge of your lane, you slightly adjust the steering wheel well ahead of time, otherwise you’ll be required to make a larger, more dynamic maneuver if you wait until the last minute. In the case of asteroid deflection, redirecting it would involve a blast or collision: imparting kinetic energy to it in an effort to change its motion. The longer you wait, and the closer the “redirect” time is to the impact time, the more energetic your efforts will need to be.

This diagram shows the orbit of the four inner terrestrial planets of our Solar System, along with the inferred orbital trajectory of asteroid 2024 YR4, as determined on January 28, 2025. After another close pass by Earth in December of 2028, asteroid 2024 YR4 will spend another four years in orbit before either making an extremely close pass by Earth or striking it on December 22, 2032. Any redirection efforts will benefit from a maximal amount of lead time. Credit: NASA/JPL

There are a few things that determine how much energy you’d need to successfully redirect an asteroid like 2024 YR4. For one, you need to know how much time you have until impact, and for us, that’s until December 22, 2032. Our next best opportunity for redirection will occur about four years prior: on December 17, 2028, when 2024 YR4 makes another (relatively) close pass of Earth. Because Earth has a mean radius of 6371 km, we’ll need to deflect the asteroid by at least that much, and in order to change a massive object’s momentum, you need a massive (or energetic) impact to it that’s capable of sufficiently changing its motion, which depends on asteroid 2024 YR4’s overall mass.

That last figure is greatly uncertain: it’s estimated at 220,000 tonnes (2.2 × 108 kg), but that’s uncertain by approximately a factor of 10. Missions like NASA’s DART or Deep Impact missions had masses of a few hundred kilograms, and can have relative speeds with respect to an asteroid that are significant: around ~10 km/s or potentially even a little more. If we’re generous, and assume:

a spacecraft mass of 1000 kg,

a relative speed of 20 km/s,

a mass for 2024 YR4 of the anticipated 2.2 × 10 8 kg,

kg, a redirect attempt in 2028, four years in advance of the potential impact,

and also assume a perfectly elastic collision between the spacecraft and the asteroid,

we could change the asteroid’s speed by about 18 centimeters-per-second. After four years, that could change the path of 2024 YR4 by up to 22,000 km: more than the full diameter of Earth.

This Hubble Space Telescope image from October 8, 2022, shows the debris emanating from asteroid Dimorphos just under 12 full days after it was impacted, on purpose, by NASA’s DART spacecraft. The debris tail changes rapidly over time, but the larger effect is the overall redirected orbit of Dimorphos, which was measured and is substantial. Credit: NASA/ESA/STScI/Hubble

Yes, there would be potential risks if we did attempt to redirect the asteroid with an impact. The asteroid could fragment, leading to a long, distended trail of debris that struck Earth. The impactor could become embedded, nudging the asteroid but failing to cause it to miss Earth. Or we could choose a worse strategy than an impactor, such as detonating a nuclear device on or near the asteroid, which could simultaneously fail to sufficiently change its course while imparting it with radioactive, potentially deadly isotopes. The optimal strategy for redirection remains to impact the asteroid, in the proper direction, at the maximum speed with the maximum mass spacecraft with as much time in advance of the potential impact with Earth as possible.

However, it’s unlikely that such a redirect mission will be required. Anything can pose a “risk of impact” if you’re bad enough at measuring it, and right now, the small, fast-moving nature of 2024 YR4 coupled with the brief window of observations we’ve acquired means that we’re sufficiently bad at measuring it that we do not know whether it will strike us or not. The odds are against it, but it will take better observations — observations which should be forthcoming — to know for sure. In all probability, the “odds of impact” will soon peak at around ~5%, and then plummet thereafter. But until we collect the critical data, we can’t know for sure. If we want to truly know what’s coming for us out there in the Universe, high-precision observations for the purpose of planetary defense are the most informative intervention we can take at present.","Asteroid 2024 YR4 was found in the vicinity of Earth on December 27, 2024. It’s approximately 50 meters in diameter, weighs somewhere around 200,000 tons. It will make its next close approach to Earth (but will definitively miss us) on December 17, 2028."
Scientists Put a Human Language Gene Into Mice And Changed Their Voice - ScienceAlert,A new contender for a human 'language gene' can change the way that mice squeak when it is incorporated into their DNA.,https://www.sciencealert.com/scientists-put-a-human-language-gene-into-mice-and-changed-their-voice,science,"A new contender for a human 'language gene' can change the way that mice squeak when it is incorporated into their DNA.

The gene is called NOVA1, and in our own species, it is remarkably unique. While virtually all other mammals have the same NOVA1 variant in their genetic code, a single change of an amino acid is seen in the human version.

This one, subtle tweak may have played a critical role in the origins of spoken language and the expansion and survival of Homo sapiens, according to researchers at Rockefeller University and the Cold Spring Harbor Laboratory in New York.

Not even Neanderthals and Denisovans have the same variant, which means it must have evolved in the last few hundred thousand years, after our species split from these extinct relatives.

Other proposed 'language genes', like FOXP2, which also make mice squeak differently are found in the DNA of Neanderthals. So even though they probably also contributed to the origins of human language, they may not be responsible for our more recent evolutionary success.

It's not clear what the language capabilities of our extinct relatives once were, but this recent change has proved highly successful in the human genome.

In more than 650,000 human DNA sequences, researchers found only six anonymous people who did not have the modern NOVA1 variant. Nothing about these individuals is known.

When it comes to the origins of complex human language, NOVA1 is ""the new kid on the block"", geneticist Wolfgang Enard who worked on the FOXP2 gene told Carl Zimmer at The New York Times.

""This gene is part of a sweeping evolutionary change in early modern humans and hints at potential ancient origins of spoken language,"" says neuro-oncologist Robert Darnell from Rockefeller University, who has been studying the gene and its links to disease and intellectual function since the early 1990s.

""NOVA1 may be a bona fide human 'language gene,' though certainly it's only one of many human-specific genetic changes.""

When Darnell and his team artificially generated the human variant of NOVA1 in mice, they found that the rodents squeaked differently. Adults and pups still made the same amount of noise, but their vocalization patterns had changed.

Compared to typical mice, genetically modified pups made higher-frequency ultrasonic squeaks. Their calls didn't get their mother's attention any more than the calls of a control pup, but these sounds may indicate an increased attempt at social interaction, albeit a failed one.

Higher frequency calls are also used by adult male mice during courtship for similar reasons. When adult male mice were genetically altered with the human NOVA1 variant, their squeaks during courtship didn't become higher pitched like the pups. Instead, their vocalizations included more complex syllables.

""They 'talked' differently to the female mice,"" explains Darnell. ""One can imagine how such changes in vocalization could have a profound impact on evolution.""

Why the mice sound different with the human NOVA1 variant is a mystery that Darnell and his colleagues are keen to solve. The team suspects that the human variant is causing molecular shifts in some parts of the developing rodent brain – whether it be the vocal pathways of the midbrain and brainstem or more recently evolved regions in the cortex, which control pitch and frequency.

The NOVA1 gene is known as a 'master gene regulator' because it influences more than 90 percent of other human genes during development.

NOVA1 encodes a protein called Nova-1 that can cut out and rearrange sections of messenger RNA when it binds to neurons. This changes how brain cells synthesize proteins, probably creating molecular diversity in the central nervous system.

When Darnell and his team 'humanized' mice with the NOVA1 variant, they found molecular changes in the RNA splicing seen in brain cells, especially in regions associated with vocal behavior.

""We thought, wow. We did not expect that,"" Darnell says. ""It was one of those really surprising moments in science.""

For Darnell, understanding NOVA1 has been a career-long effort.

NOVA1 is thought to help regulate learning in humans, and mutations in this gene can cause severe psychiatric disorders and abnormalities in motor development.

Its role in speech development is just starting to emerge, and while much remains hypothetical, the possibilities are profound.

""Our data show that an ancestral population of modern humans in Africa evolved the human variant I197V, which then became dominant, perhaps because it conferred advantages related to vocal communication,"" suggests Darnell.

""This population then left Africa and spread across the world.""

No doubt having a chat on the way.

The study was published in Nature Communications.","The gene is called NOVA1, and in our own species, it is remarkably unique. Not even Neanderthals and Denisovans have the same variant. It must have evolved in the last few hundred thousand years, after our species split from these extinct relatives."
Science suggests we should stop using ‘bird brain’ as a barb - Financial Times,The gap between avian and mammalian cognition may be narrower than we think,https://www.ft.com/content/61950379-f7d0-45c9-9903-9e38903b8a42,science,"Limited time offer Save 40% on Standard Digital

was ₩594000 now ₩355000 for your first year Make up your own mind. Build robust opinions on the FT's trusted journalism. Offer available until 27 February 2025.",Use the weekly Newsquiz to test your knowledge of stories you saw on the FT. Send your pictures and videos to jennifer.smith@dailymail.co.uk.
